{
  "url": "https://www.iit.edu/student-accounting/tuition-and-fees/mandatory-and-other-fees",
  "status": "success",
  "timestamp": "2026-02-19T11:45:18.051142",
  "title": "Mandatory and Other Fees | Illinois Institute of Technology",
  "headings": {
    "h1": [
      "Mandatory and Other Fees"
    ],
    "h2": [
      "Activity Fee",
      "Co-Curricular Fee",
      "Graduate Continuation Studies Fee",
      "Graduation Fee",
      "New Student Fee",
      "Student Health Insurance",
      "Student Service Fee",
      "U-Pass Fee",
      "Deferment Plan Fee",
      "Late Fee",
      "Late Registration Fee",
      "Payment Plan Fee",
      "Returned Check Fee",
      "UMII Scholarship Fee (opt-in)",
      "Learn more...",
      "Contact",
      "Social Media Links",
      "Campus",
      "Web Links",
      ".",
      "We use technologies such as cookies to customize content and advertising, to provide social media features, and to analyze traffic to the site. By using or registering on any portion of this site, you agree to our privacy and cookie statement."
    ],
    "h3": [
      "Tuition and Fees"
    ]
  },
  "paragraphs": [
    "The student activity fee is a mandatory fee that assists programs directly related to campus activities in conjunction with student organizations. The use and allocation of this fee is handled directly by students via the Finance Board, with accountability to the Student Government Association. This fee supports student organizations' operational, programming, and conference budgets as well as large-scale campus events.",
    "The Co-curricular Fee is a mandatory fee assessed to all IIT Stuart students in the fall and spring semesters. The fee supports co-curricular programs that enhance students' academic experience and increase their career readiness.",
    "All graduate students must register for a course during the semester of graduation. This is advised throughout the graduate degree program, when the application for graduation is submitted online, and again when the degree audit results are provided to the student by email. Failure by the student to complete this requirement results in administrative registration and the automatic charge of the graduate continuing student course fee before the degree is conferred. The course fee will not be waived. The policy regarding registration in the semester of graduation is published in each Graduate Bulletin:catalog.iit.edu/graduate/academic-policies-procedures/registration/. If you have questions about this fee, you can reach out to the Graduate College directly at gradcoll@illinoistech.edu or 312-567-3024.",
    "The mandatory graduation fee is intended to cover all administrative costs associated with the application, checkout, posting, and degree reporting processes. This fee is administered by the Undergraduate and Graduate Academic Affairs offices. Students who submit an application for graduation late will be assessed a late graduation fee.",
    "The first-year student fee is a mandatory one-time fee assessed to all new students. The fee covers the new-student orientation program provided at the beginning of each semester and funds first-year student programs.",
    "Health insurance is assessed to all domestic students enrolled in at least one billable hour and have not provided adequate proof of insurance information to Student Health Services by the waiver deadline.Health insurance is mandatory for all international students on an F1 or J1 visa for every term the student is enrolled in at least one billable hour. Information about this fee can be found on the student health and wellness website:Student Health Services website.",
    "The student service fee is a mandatory fee that supports many on-campus departments such as Athletics, Paul V. Galvin Library, Career Services, Technology Services and the Student Health and Wellness Center.",
    "Illinois Tech is a participating school in the Chicago Transit Authority's (CTA) University Pass (U-Pass) Program. The program is intended to offer convenient, reduced-cost transportation to students, supporting accessibility to school and the Chicago metropolitan area with unlimited rides on CTA buses and trains throughout the duration of an academic term. To facilitate UPass entitlements, Ventra cards will be issued to participating students. Ventra cards are intended to last through the full duration of a student's enrollment with Illinois Tech.",
    "UPass entitlements are not valid between academic terms. Ventra card holders are expected to add value to their transit accounts for bus and train rides during those times. Ventra UPass card holders may also add value for trips with friends and family. On those occasions, the first ride will be applied to their UPass. The additional rides on that trip will be applied as full regular fare to the transit account. In the event additional rides results in a negative balance, the student is expected to add value to resume use of their UPass.",
    "Effective Fall 2023, optional enrollment for the UPass Program will continue indefinitely. Additionally, CTA has expanded UPass eligibility to include part-time students registered for 6 credit hours or more per semester. Undergraduate and Graduate students may opt-in for the UPass AFTER they are registered for 6 billable academic hours.",
    "A deferment plan fee is assessed to any student that chooses to enroll in thetuition deferment programoffered by IIT during the open registration dates.",
    "Late fees are assessed to delinquent student accounts at a rate of 2% - 5% per month. Students who enroll in a payment plan and make their payments after the due date are assessed a monthly late fee.",
    "Students should register at their earliest opportunity. Those who register late may be required to pay a late registration fee to do so. Information about registration periods including late registration can be found in theCourse Schedule.",
    "A payment plan fee is assessed to any student that chooses to enroll in a formal payment plan offered by IIT during the open registration dates.",
    "Each time a check or electronic check is returned as unpayable by the bank for insufficient funds, invalid routing and/or account information, stop payment, or any other reason, the payee is assessed a returned check fee.",
    "The United Minds Inspiring Innovation (UMII) scholarship fee supports an application-based scholarship for undergraduate undocumented students who are ineligible for federal financial aid (FAFSA). This opt-in scholarship fee was passed through an SGA referendum proposed to undergraduate students in the spring 2016 elections. If you wish to donate more to this initiative, please visit the UMII Scholarship donation. This fee is presented through Manage My Account every time any student/authorized user makes a payment. All donations are tax-deductible.",
    "All tuition and fees are subject to revision by Illinois Tech’s Board of Trustees.",
    "10 West 35th StreetChicago, IL 60616",
    "312.567.3000",
    "Contact Us"
  ],
  "links": [
    {
      "text": "Skip to main site navigation",
      "href": "#main-menu"
    },
    {
      "text": "Skip to main content",
      "href": "#main-content"
    },
    {
      "text": "Request Info",
      "href": "/admissions-aid/request-information"
    },
    {
      "text": "Visit",
      "href": "/admissions-aid/visit-and-tour"
    },
    {
      "text": "Apply",
      "href": "/admissions-aid/apply"
    },
    {
      "text": "",
      "href": "/"
    },
    {
      "text": "",
      "href": "/"
    },
    {
      "text": "Directory",
      "href": "/directory/people"
    },
    {
      "text": "News",
      "href": "/university-news"
    },
    {
      "text": "Alumni",
      "href": "https://www.iit.edu/alumni"
    },
    {
      "text": "Events",
      "href": "/events"
    },
    {
      "text": "Giving",
      "href": "/giving"
    },
    {
      "text": "Illinois Tech Mumbai",
      "href": "/mumbai"
    },
    {
      "text": "Academic Advising",
      "href": "/academic-advising"
    },
    {
      "text": "Admitted Students",
      "href": "/resources-admitted-students"
    },
    {
      "text": "Academic Calendar",
      "href": "https://www.iit.edu/registrar/academic-calendar"
    },
    {
      "text": "Community",
      "href": "https://www.iit.edu/community-affairs"
    },
    {
      "text": "Current Students",
      "href": "/resources-current-students"
    },
    {
      "text": "Faculty and Staff",
      "href": "/resources-faculty-and-staff"
    },
    {
      "text": "Parents and Families",
      "href": "/resources-parents-and-families"
    },
    {
      "text": "School Counselors",
      "href": "/resources-school-counselors"
    },
    {
      "text": "Title IX Compliance",
      "href": "https://www.iit.edu/title-ix"
    },
    {
      "text": "Academics",
      "href": "/academics"
    },
    {
      "text": "Academic Programs",
      "href": "/academics/programs"
    },
    {
      "text": "Experiential Learning",
      "href": "/academics/experiential-learning"
    },
    {
      "text": "Undergraduate Programs",
      "href": "/academics/undergraduate-programs"
    },
    {
      "text": "Graduate Programs",
      "href": "/academics/graduate-programs"
    },
    {
      "text": "Lifelong Learners",
      "href": "/academics/lifelong-learners"
    },
    {
      "text": "Elevate College Prep",
      "href": "/academics/elevate-college-prep"
    },
    {
      "text": "Colleges and Institutes",
      "href": "/academics/colleges-and-institutes"
    },
    {
      "text": "Academic Calendar",
      "href": "/registrar/academic-calendar"
    },
    {
      "text": "Course Catalog",
      "href": "/academics/course-catalog"
    },
    {
      "text": "Admission and Aid",
      "href": "/admissions-aid"
    },
    {
      "text": "Apply",
      "href": "/admissions-aid/apply"
    },
    {
      "text": "Undergraduate Admission",
      "href": "/admissions-aid/undergraduate-admission"
    },
    {
      "text": "Graduate Admission",
      "href": "/admissions-aid/graduate-admission"
    },
    {
      "text": "Tuition and Aid",
      "href": "/admissions-aid/tuition-and-aid"
    },
    {
      "text": "Visit and Tour",
      "href": "/admissions-aid/visit-and-tour"
    },
    {
      "text": "Request Information",
      "href": "/admissions-aid/request-information"
    },
    {
      "text": "Student Experience",
      "href": "/student-experience"
    },
    {
      "text": "Our Campus and Housing",
      "href": "/student-experience/campus-and-housing"
    },
    {
      "text": "Life in Chicago",
      "href": "/student-experience/life-in-chicago"
    },
    {
      "text": "Career Services and Internships",
      "href": "/student-experience/career-services-and-internships"
    },
    {
      "text": "Student Outcomes",
      "href": "/student-experience/student-outcomes"
    },
    {
      "text": "Athletics",
      "href": "/student-experience/athletics"
    },
    {
      "text": "Student Organizations and Greek Life",
      "href": "/student-experience/student-organizations-and-greek-life"
    },
    {
      "text": "Services and Resources",
      "href": "/student-experience/services-and-resources"
    },
    {
      "text": "Student and Alumni Stories",
      "href": "/student-experience/student-and-alumni-stories"
    },
    {
      "text": "New Student Transition",
      "href": "/student-experience/new-student-transition"
    },
    {
      "text": "Research",
      "href": "/research"
    }
  ],
  "list_items": [
    "Directory",
    "News",
    "Alumni",
    "Events",
    "Giving",
    "Illinois Tech Mumbai",
    "Resources for...Academic AdvisingAdmitted StudentsAcademic CalendarCommunityCurrent StudentsFaculty and StaffParents and FamiliesSchool CounselorsTitle IX Compliance",
    "Academic Advising",
    "Admitted Students",
    "Academic Calendar",
    "Community",
    "Current Students",
    "Faculty and Staff",
    "Parents and Families",
    "School Counselors",
    "Title IX Compliance",
    "AcademicsAcademic ProgramsExperiential LearningUndergraduate ProgramsGraduate ProgramsLifelong LearnersElevate College PrepColleges and InstitutesAcademic CalendarCourse Catalog",
    "Academic Programs",
    "Experiential Learning",
    "Undergraduate Programs",
    "Graduate Programs",
    "Lifelong Learners",
    "Elevate College Prep",
    "Colleges and Institutes",
    "Academic Calendar",
    "Course Catalog",
    "Admission and AidApplyUndergraduate AdmissionGraduate AdmissionTuition and AidVisit and TourRequest Information",
    "Apply",
    "Undergraduate Admission",
    "Graduate Admission",
    "Tuition and Aid",
    "Visit and Tour",
    "Request Information",
    "Student ExperienceOur Campus and HousingLife in ChicagoCareer Services and InternshipsStudent OutcomesAthleticsStudent Organizations and Greek LifeServices and ResourcesStudent and Alumni StoriesNew Student Transition",
    "Our Campus and Housing",
    "Life in Chicago",
    "Career Services and Internships",
    "Student Outcomes",
    "Athletics",
    "Student Organizations and Greek Life",
    "Services and Resources",
    "Student and Alumni Stories",
    "New Student Transition",
    "ResearchAbout ResearchUniversity Research InitiativesConducting Research with Illinois TechFeatured ProjectsStudent ResearchInstitutes and CentersLibraries",
    "About Research",
    "University Research Initiatives",
    "Conducting Research with Illinois Tech",
    "Featured Projects",
    "Student Research",
    "Institutes and Centers",
    "Libraries",
    "AboutMission and VisionHistory of Illinois TechLeadershipAdministrative OfficesContact UsCampus InformationRankings and Recognition",
    "Mission and Vision",
    "History of Illinois Tech",
    "Leadership",
    "Administrative Offices",
    "Contact Us",
    "Campus Information",
    "Rankings and Recognition",
    "Home",
    "Student Accounting",
    "Tuition and Fees",
    "Mandatory and Other Fees",
    "Current Tuition and FeesMies Campus UGMies Campus GradStuart School of BusinessInstitute of DesignChicago-Kent College of LawCurrent Intensive English Program",
    "Mies Campus UG",
    "Mies Campus Grad",
    "Stuart School of Business",
    "Institute of Design",
    "Chicago-Kent College of Law",
    "Current Intensive English Program",
    "Future Tuition and FeesMies Campus UGMies Campus GradStuart School of BusinessInstitute of DesignChicago-Kent College of Law",
    "Mies Campus UG",
    "Mies Campus Grad",
    "Stuart School of Business",
    "Institute of Design",
    "Chicago-Kent College of Law",
    "Previous Tuition and FeesMies Campus UGMies Campus GradStuart School of BusinessInstitute of DesignChicago-Kent College of Law",
    "Mies Campus UG",
    "Mies Campus Grad",
    "Stuart School of Business",
    "Institute of Design",
    "Chicago-Kent College of Law",
    "Mandatory and Other FeesCurrent Year Course FeesPrevious Years Course FeesFuture Year Course FeesHealth Insurance",
    "Current Year Course Fees",
    "Previous Years Course Fees",
    "Future Year Course Fees",
    "Health Insurance",
    "2024 Winter Term Courses",
    "Activity Fee",
    "Co-Curricular Fee",
    "Graduation Continuation Studies Fee",
    "Graduation Fee",
    "New Student Fee",
    "Student Health Insurance",
    "Student Service Fee",
    "UPass Fee",
    "Deferment Plan Fee",
    "Late Fee",
    "Late Registration Fee",
    "Payment Plan Fee",
    "Returned Check Fee",
    "UMII Scholarship Fee (opt-in)",
    "Facebook",
    "Instagram",
    "LinkedIn",
    "Twitter",
    "YouTube",
    "Emergency Information",
    "Employment",
    "Alumni",
    "Illinois Tech Portal",
    "Privacy",
    "Copyright Concerns",
    "IBHE Online Complaint System",
    "Student Complaint Information",
    "Student Non-Discrimination Policy"
  ],
  "tables": [],
  "main_content": "Mandatory and Other Fees | Illinois Institute of Technology Skip to main site navigation Skip to main content Request Info Visit Apply Search term or keyword... Search Directory News Alumni Events Giving Illinois Tech Mumbai Resources for... Academic Advising Admitted Students Academic Calendar Community Current Students Faculty and Staff Parents and Families School Counselors Title IX Compliance Academics Academic Programs Experiential Learning Undergraduate Programs Graduate Programs Lifelong Learners Elevate College Prep Colleges and Institutes Academic Calendar Course Catalog Admission and Aid Apply Undergraduate Admission Graduate Admission Tuition and Aid Visit and Tour Request Information Student Experience Our Campus and Housing Life in Chicago Career Services and Internships Student Outcomes Athletics Student Organizations and Greek Life Services and Resources Student and Alumni Stories New Student Transition Research About Research University Research Initiatives Conducting Research with Illinois Tech Featured Projects Student Research Institutes and Centers Libraries About Mission and Vision History of Illinois Tech Leadership Administrative Offices Contact Us Campus Information Rankings and Recognition Request Info Visit Apply Student Accounting Mandatory and Other Fees Home Student Accounting Tuition and Fees Mandatory and Other Fees More In This Section Click to expose navigation links on mobile Tuition and Fees Current Tuition and Fees Mies Campus UG Mies Campus Grad Stuart School of Business Institute of Design Chicago-Kent College of Law Current Intensive English Program Future Tuition and Fees Mies Campus UG Mies Campus Grad Stuart School of Business Institute of Design Chicago-Kent College of Law Previous Tuition and Fees Mies Campus UG Mies Campus Grad Stuart School of Business Institute of Design Chicago-Kent College of Law Mandatory and Other Fees Current Year Course Fees Previous Years Course Fees Future Year Course Fees Health Insurance 2024 Winter Term Courses Activity Fee Co-Curricular Fee Graduation Continuation Studies Fee Graduation Fee New Student Fee Student Health Insurance Student Service Fee UPass Fee Deferment Plan Fee Late Fee Late Registration Fee Payment Plan Fee Returned Check Fee UMII Scholarship Fee (opt-in) Activity Fee The student activity fee is a mandatory fee that assists programs directly related to campus activities in conjunction with student organizations. The use and allocation of this fee is handled directly by students via the Finance Board, with accountability to the Student Government Association. This fee supports student organizations' operational, programming, and conference budgets as well as large-scale campus events. Co-Curricular Fee The Co-curricular Fee is a mandatory fee assessed to all IIT Stuart students in the fall and spring semesters. The fee supports co-curricular programs that enhance students' academic experience and increase their career readiness. Graduate Continuation Studies Fee All graduate students must register for a course during the semester of graduation. This is advised throughout the graduate degree program, when the application for graduation is submitted online, and again when the degree audit results are provided to the student by email. Failure by the student to complete this requirement results in administrative registration and the automatic charge of the graduate continuing student course fee before the degree is conferred. The course fee will not be waived. The policy regarding registration in the semester of graduation is published in each Graduate Bulletin: catalog.iit.edu/graduate/academic-policies-procedures/registration/ . If you have questions about this fee, you can reach out to the Graduate College directly at gradcoll@illinoistech.edu or 312-567-3024. Graduation Fee The mandatory graduation fee is intended to cover all administrative costs associated with the application, checkout, posting, and degree reporting processes. This fee is administered by the Undergraduate and Graduate Academic Affairs offices. Students who submit an application for graduation late will be assessed a late graduation fee. New Student Fee The first-year student fee is a mandatory one-time fee assessed to all new students. The fee covers the new-student orientation program provided at the beginning of each semester and funds first-year student programs. Student Health Insurance Health insurance is assessed to all domestic students enrolled in at least one billable hour and have not provided adequate proof of insurance information to Student Health Services by the waiver deadline. Health insurance is mandatory for all international students on an F1 or J1 visa for every term the student is enrolled in at least one billable hour. Information about this fee can be found on the student health and wellness website: Student Health Services website . Student Service Fee The student service fee is a mandatory fee that supports many on-campus departments such as Athletics, Paul V. Galvin Library, Career Services, Technology Services and the Student Health and Wellness Center. U-Pass Fee Illinois Tech is a participating school in the Chicago Transit Authority's (CTA) University Pass (U-Pass) Program. The program is intended to offer convenient, reduced-cost transportation to students, supporting accessibility to school and the Chicago metropolitan area with unlimited rides on CTA buses and trains throughout the duration of an academic term. To facilitate UPass entitlements, Ventra cards will be issued to participating students. Ventra cards are intended to last through the full duration of a student's enrollment with Illinois Tech. UPass entitlements are not valid between academic terms. Ventra card holders are expected to add value to their transit accounts for bus and train rides during those times. Ventra UPass card holders may also add value for trips with friends and family. On those occasions, the first ride will be applied to their UPass. The additional rides on that trip will be applied as full regular fare to the transit account. In the event additional rides results in a negative balance, the student is expected to add value to resume use of their UPass. Effective Fall 2023, optional enrollment for the UPass Program will continue indefinitely. Additionally, CTA has expanded UPass eligibility to include part-time students registered for 6 credit hours or more per semester. Undergraduate and Graduate students may opt-in for the UPass AFTER they are registered for 6 billable academic hours. Deferment Plan Fee A deferment plan fee is assessed to any student that chooses to enroll in the tuition deferment program offered by IIT during the open registration dates. Late Fee Late fees are assessed to delinquent student accounts at a rate of 2% - 5% per month. Students who enroll in a payment plan and make their payments after the due date are assessed a monthly late fee. Late Registration Fee Students should register at their earliest opportunity. Those who register late may be required to pay a late registration fee to do so. Information about registration periods including late registration can be found in the Course Schedule . Payment Plan Fee A payment plan fee is assessed to any student that chooses to enroll in a formal payment plan offered by IIT during the open registration dates. Returned Check Fee Each time a check or electronic check is returned as unpayable by the bank for insufficient funds, invalid routing and/or account information, stop payment, or any other reason, the payee is assessed a returned check fee. UMII Scholarship Fee (opt-in) The United Minds Inspiring Innovation (UMII) scholarship fee supports an application-based scholarship for undergraduate undocumented students who are ineligible for federal financial aid (FAFSA). This opt-in scholarship fee was passed through an SGA referendum proposed to undergraduate students in the spring 2016 elections. If you wish to donate more to this initiative, please visit the UMII Scholarship donation. This fee is presented through Manage My Account every time any student/authorized user makes a payment. All donations are tax-deductible. All tuition and fees are subject to revision by Illinois Tech’s Board of Trustees. Learn more... Illinois Tech welcomes you to join our community of people who discover, create, and solve. Apply today, visit us in Chicago, and contact us for more information. Request Info Visit Apply Contact 10 West 35th Street Chicago, IL 60616 312.567.3000 Contact Us Social Media Links Facebook Instagram LinkedIn Twitter YouTube Campus Emergency Information Employment Alumni Illinois Tech Portal Web Links Privacy Copyright Concerns IBHE Online Complaint System Student Complaint Information Student Non-Discrimination Policy . We use technologies such as cookies to customize content and advertising, to provide social media features, and to analyze traffic to the site. By using or registering on any portion of this site, you agree to our privacy and cookie statement. Dismiss Privacy Statement"
}